{
  "raw_response": "<BRANCHES>\n[\n  {\n    \"code\": \"if(tunnelIdCustomName.length()>1)\",\n    \"type\": \"If-Else\",\n    \"file\": \"PerfectoBuildWrapper.java\",\n    \"outcome\": \"True - the length should be more than 1\"\n  },\n  {\n    \"code\": \"if(perfectoConnectLocation.endsWith('/')||perfectoConnectLocation.endsWith('\\\\'))\",\n    \"type\": \"If-Else\",\n    \"file\": \"PerfectoBuildWrapper.java\",\n    \"outcome\": \"Either True or False - the path should end with a slash or backslash\"\n  },\n  {\n    \"code\": \"if (isWindows)\",\n    \"type\": \"If-Else\",\n    \"file\": \"PerfectoBuildWrapper.java\",\n    \"outcome\": \"True - the system should be Windows\"\n  },\n  {\n    \"code\": \"if (m.find())\",\n    \"type\": \"If-Else\",\n    \"file\": \"PerfectoBuildWrapper.java\",\n    \"outcome\": \"True - a match should be found\"\n  },\n  {\n    \"code\": \"if(s.contains('bash: '))\",\n    \"type\": \"If-Else\",\n    \"file\": \"PerfectoBuildWrapper.java\",\n    \"outcome\": \"False - the string should not contain 'bash: '\"\n  }\n]\n</BRANCHES>\n\n<INPUT_CONDITIONS>\n[\n  {\n    \"condition\": \"tunnelIdCustomName length should be more than 1\",\n    \"reason\": \"to pass the if condition at line 142\"\n  },\n  {\n    \"condition\": \"perfectoConnectLocation should end with a slash or backslash\",\n    \"reason\": \"to pass the if condition at line 155\"\n  },\n  {\n    \"condition\": \"System should be Windows\",\n    \"reason\": \"to execute the command using cmd.exe at line 163\"\n  },\n  {\n    \"condition\": \"Input string should match the pattern '^[A-Za-z0-9-]+$'\",\n    \"reason\": \"to find a match at line 175\"\n  },\n  {\n    \"condition\": \"Input string should not contain 'bash: '\",\n    \"reason\": \"to avoid a fatal error at line 180\"\n  }\n]\n</INPUT_CONDITIONS>",
  "branches": [
    {
      "code": "if(tunnelIdCustomName.length()>1)",
      "type": "If-Else",
      "file": "PerfectoBuildWrapper.java",
      "outcome": "True - the length should be more than 1"
    },
    {
      "code": "if(perfectoConnectLocation.endsWith('/')||perfectoConnectLocation.endsWith('\\'))",
      "type": "If-Else",
      "file": "PerfectoBuildWrapper.java",
      "outcome": "Either True or False - the path should end with a slash or backslash"
    },
    {
      "code": "if (isWindows)",
      "type": "If-Else",
      "file": "PerfectoBuildWrapper.java",
      "outcome": "True - the system should be Windows"
    },
    {
      "code": "if (m.find())",
      "type": "If-Else",
      "file": "PerfectoBuildWrapper.java",
      "outcome": "True - a match should be found"
    },
    {
      "code": "if(s.contains('bash: '))",
      "type": "If-Else",
      "file": "PerfectoBuildWrapper.java",
      "outcome": "False - the string should not contain 'bash: '"
    }
  ],
  "input_conditions": [
    {
      "condition": "tunnelIdCustomName length should be more than 1",
      "reason": "to pass the if condition at line 142"
    },
    {
      "condition": "perfectoConnectLocation should end with a slash or backslash",
      "reason": "to pass the if condition at line 155"
    },
    {
      "condition": "System should be Windows",
      "reason": "to execute the command using cmd.exe at line 163"
    },
    {
      "condition": "Input string should match the pattern '^[A-Za-z0-9-]+$'",
      "reason": "to find a match at line 175"
    },
    {
      "condition": "Input string should not contain 'bash: '",
      "reason": "to avoid a fatal error at line 180"
    }
  ],
  "evidence_count": 1
}