{
  "raw_response": "<BRANCHES>\n[\n  {\n    \"code\": \"if(perfectoConnectLocation.endsWith(\\\"/\\\")||perfectoConnectLocation.endsWith(\\\"\\\\\\\"))\",\n    \"type\": \"If-Else\",\n    \"file\": \"PerfectoBuildWrapper.java\",\n    \"outcome\": \"True - the path should end with a slash or backslash\"\n  },\n  {\n    \"code\": \"if (isWindows)\",\n    \"type\": \"If-Else\",\n    \"file\": \"PerfectoBuildWrapper.java\",\n    \"outcome\": \"True - the system should be Windows\"\n  },\n  {\n    \"code\": \"if (m.find())\",\n    \"type\": \"If-Else\",\n    \"file\": \"PerfectoBuildWrapper.java\",\n    \"outcome\": \"True - the input should match the pattern\"\n  },\n  {\n    \"code\": \"if(s.contains(\\\"bash: \\\"))\",\n    \"type\": \"If-Else\",\n    \"file\": \"PerfectoBuildWrapper.java\",\n    \"outcome\": \"False - the input should not contain 'bash: '\"\n  },\n  {\n    \"code\": \"if(tunnelIdCustomName.length()>1)\",\n    \"type\": \"If-Else\",\n    \"file\": \"PerfectoBuildWrapper.java\",\n    \"outcome\": \"True - the tunnelIdCustomName should be longer than 1 character\"\n  }\n]\n</BRANCHES>\n\n<INPUT_CONDITIONS>\n[\n  {\n    \"condition\": \"perfectoConnectLocation should end with a slash or backslash\",\n    \"reason\": \"to construct the correct pcLocation\"\n  },\n  {\n    \"condition\": \"the system should be Windows\",\n    \"reason\": \"to use the correct command execution\"\n  },\n  {\n    \"condition\": \"the input should match the pattern '^[A-Za-z0-9-]+$'\",\n    \"reason\": \"to extract the tunnelId\"\n  },\n  {\n    \"condition\": \"the input should not contain 'bash: '\",\n    \"reason\": \"to avoid fatal error\"\n  },\n  {\n    \"condition\": \"tunnelIdCustomName should be longer than 1 character\",\n    \"reason\": \"to set the tunnelIdCustomName\"\n  }\n]\n</INPUT_CONDITIONS>",
  "branches": [
    {
      "code": "if(perfectoConnectLocation.endsWith(\"/\")||perfectoConnectLocation.endsWith(\"\\\"))",
      "type": "If-Else",
      "file": "PerfectoBuildWrapper.java",
      "outcome": "True - the path should end with a slash or backslash"
    },
    {
      "code": "if (isWindows)",
      "type": "If-Else",
      "file": "PerfectoBuildWrapper.java",
      "outcome": "True - the system should be Windows"
    },
    {
      "code": "if (m.find())",
      "type": "If-Else",
      "file": "PerfectoBuildWrapper.java",
      "outcome": "True - the input should match the pattern"
    },
    {
      "code": "if(s.contains(\"bash: \"))",
      "type": "If-Else",
      "file": "PerfectoBuildWrapper.java",
      "outcome": "False - the input should not contain 'bash: '"
    },
    {
      "code": "if(tunnelIdCustomName.length()>1)",
      "type": "If-Else",
      "file": "PerfectoBuildWrapper.java",
      "outcome": "True - the tunnelIdCustomName should be longer than 1 character"
    }
  ],
  "input_conditions": [
    {
      "condition": "perfectoConnectLocation should end with a slash or backslash",
      "reason": "to construct the correct pcLocation"
    },
    {
      "condition": "the system should be Windows",
      "reason": "to use the correct command execution"
    },
    {
      "condition": "the input should match the pattern '^[A-Za-z0-9-]+$'",
      "reason": "to extract the tunnelId"
    },
    {
      "condition": "the input should not contain 'bash: '",
      "reason": "to avoid fatal error"
    },
    {
      "condition": "tunnelIdCustomName should be longer than 1 character",
      "reason": "to set the tunnelIdCustomName"
    }
  ],
  "evidence_count": 1
}