{
  "raw_response": "<BRANCHES>\n[\n  {\n    \"code\": \"if (credentials!= null)\",\n    \"type\": \"If-Else\",\n    \"file\": \"src/main/java/io/plugins/perfecto/PerfectoBuildWrapper.java\",\n    \"outcome\": \"True - credentials object should not be null to proceed\"\n  },\n  {\n    \"code\": \"if (apiKeySecret!= null)\",\n    \"type\": \"If-Else\",\n    \"file\": \"src/main/java/io/plugins/perfecto/PerfectoBuildWrapper.java\",\n    \"outcome\": \"True - apiKeySecret object should not be null to proceed\"\n  },\n  {\n    \"code\": \"if (pcLocation!= null &&!pcLocation.isEmpty())\",\n    \"type\": \"If-Else\",\n    \"file\": \"src/main/java/io/plugins/perfecto/PerfectoBuildWrapper.java\",\n    \"outcome\": \"True - pcLocation should not be null or empty to proceed\"\n  },\n  {\n    \"code\": \"if (cloudName!= null &&!cloudName.isEmpty())\",\n    \"type\": \"If-Else\",\n    \"file\": \"src/main/java/io/plugins/perfecto/PerfectoBuildWrapper.java\",\n    \"outcome\": \"True - cloudName should not be null or empty to proceed\"\n  },\n  {\n    \"code\": \"if (apiKey!= null &&!apiKey.isEmpty())\",\n    \"type\": \"If-Else\",\n    \"file\": \"src/main/java/io/plugins/perfecto/PerfectoBuildWrapper.java\",\n    \"outcome\": \"True - apiKey should not be null or empty to proceed\"\n  }\n]\n</BRANCHES>\n\n<INPUT_CONDITIONS>\n[\n  {\n    \"condition\": \"credentials object should not be null\",\n    \"rationale\": \"To ensure retrieval of apiKeySecret\"\n  },\n  {\n    \"condition\": \"apiKeySecret object should not be null\",\n    \"rationale\": \"To extract plaintext apiKey\"\n  },\n  {\n    \"condition\": \"pcLocation should not be null or empty\",\n    \"rationale\": \"To construct baseCommand\"\n  },\n  {\n    \"condition\": \"cloudName should not be null or empty\",\n    \"rationale\": \"To construct baseCommand\"\n  },\n  {\n    \"condition\": \"apiKey should not be null or empty\",\n    \"rationale\": \"To construct baseCommand and ensure execution\"\n  }\n]\n</INPUT_CONDITIONS>",
  "branches": [
    {
      "code": "if (credentials!= null)",
      "type": "If-Else",
      "file": "src/main/java/io/plugins/perfecto/PerfectoBuildWrapper.java",
      "outcome": "True - credentials object should not be null to proceed"
    },
    {
      "code": "if (apiKeySecret!= null)",
      "type": "If-Else",
      "file": "src/main/java/io/plugins/perfecto/PerfectoBuildWrapper.java",
      "outcome": "True - apiKeySecret object should not be null to proceed"
    },
    {
      "code": "if (pcLocation!= null &&!pcLocation.isEmpty())",
      "type": "If-Else",
      "file": "src/main/java/io/plugins/perfecto/PerfectoBuildWrapper.java",
      "outcome": "True - pcLocation should not be null or empty to proceed"
    },
    {
      "code": "if (cloudName!= null &&!cloudName.isEmpty())",
      "type": "If-Else",
      "file": "src/main/java/io/plugins/perfecto/PerfectoBuildWrapper.java",
      "outcome": "True - cloudName should not be null or empty to proceed"
    },
    {
      "code": "if (apiKey!= null &&!apiKey.isEmpty())",
      "type": "If-Else",
      "file": "src/main/java/io/plugins/perfecto/PerfectoBuildWrapper.java",
      "outcome": "True - apiKey should not be null or empty to proceed"
    }
  ],
  "input_conditions": [
    {
      "condition": "credentials object should not be null",
      "rationale": "To ensure retrieval of apiKeySecret"
    },
    {
      "condition": "apiKeySecret object should not be null",
      "rationale": "To extract plaintext apiKey"
    },
    {
      "condition": "pcLocation should not be null or empty",
      "rationale": "To construct baseCommand"
    },
    {
      "condition": "cloudName should not be null or empty",
      "rationale": "To construct baseCommand"
    },
    {
      "condition": "apiKey should not be null or empty",
      "rationale": "To construct baseCommand and ensure execution"
    }
  ],
  "evidence_count": 0
}