{
  "raw_response": "Looking at the SARIF summary, I can see this is about path injection vulnerabilities in Jenkins library handling code. However, the evidence provided shows command injection vulnerabilities in Perfecto plugin code. Since the SARIF summary points to specific locations in Jenkins library code that I don't have the actual code for, I'll focus on the evidence provided which shows clear command injection flows.\n\nBased on the evidence, I can trace a dataflow from external input to command execution:\n\n<FLOW>\n[\n  {\n    \"role\": \"Source\",\n    \"code\": \"String baseCommand = pcLocation.trim() + \\\" start -c \\\" + cloudNameInput.trim() + \\n                           \\\".perfectomobile.com -s \\\" + apiKey.trim();\",\n    \"variable\": \"cloudNameInput\",\n    \"file\": \"src/test/java/PerfectoPathInjectionTest.java\",\n    \"start_line\": 116,\n    \"remarks\": \"External input cloudNameInput is concatenated into baseCommand\"\n  },\n  {\n    \"role\": \"Intermediate\",\n    \"code\": \"String[] cmdArgs = {\\\"cmd.exe\\\", \\\"/c\\\", baseCommand + \\\" \\\" + pcParameters.trim()};\",\n    \"variable\": \"baseCommand\",\n    \"file\": \"src/test/java/PerfectoPathInjectionTest.java\",\n    \"start_line\": 118,\n    \"remarks\": \"baseCommand containing tainted input is used to construct cmdArgs\"\n  },\n  {\n    \"role\": \"Sink\",\n    \"code\": \"Runtime.getRuntime().exec(cmdArgs);\",\n    \"variable\": \"cmdArgs\",\n    \"file\": \"src/test/java/PerfectoPathInjectionTest.java\",\n    \"start_line\": 121,\n    \"remarks\": \"cmdArgs with tainted data is passed to Runtime.exec()\"\n  }\n]\n</FLOW>",
  "flow": [
    {
      "role": "Source",
      "code": "String baseCommand = pcLocation.trim() + \" start -c \" + cloudNameInput.trim() + \n                           \".perfectomobile.com -s \" + apiKey.trim();",
      "variable": "cloudNameInput",
      "file": "src/test/java/PerfectoPathInjectionTest.java",
      "start_line": 116,
      "remarks": "External input cloudNameInput is concatenated into baseCommand"
    },
    {
      "role": "Intermediate",
      "code": "String[] cmdArgs = {\"cmd.exe\", \"/c\", baseCommand + \" \" + pcParameters.trim()};",
      "variable": "baseCommand",
      "file": "src/test/java/PerfectoPathInjectionTest.java",
      "start_line": 118,
      "remarks": "baseCommand containing tainted input is used to construct cmdArgs"
    },
    {
      "role": "Sink",
      "code": "Runtime.getRuntime().exec(cmdArgs);",
      "variable": "cmdArgs",
      "file": "src/test/java/PerfectoPathInjectionTest.java",
      "start_line": 121,
      "remarks": "cmdArgs with tainted data is passed to Runtime.exec()"
    }
  ],
  "evidence_count": 6
}